{
  "$schema": "../schemas/vz-0.4-migration-barriers.schema.json",
  "schema_version": 1,
  "kind": "vz-0.4-migration-barriers",
  "target_release": "0.4.0",
  "contract_state": "draft_unverified",
  "normative_source": "planning/developer-environments/GOAL-0.4.0.md#installation-and-migration-fixture",
  "legacy_release_tag": "v0.3.20",
  "barriers": [
    {
      "id": "mig.filesystem.state_store_backup",
      "domain": "filesystem",
      "component": "vz-runtimed state store file",
      "source_reference": "planning/developer-environments/GOAL-0.4.0.md#installation-and-migration-fixture (backup restoration and v0.3.20 rollback readability)",
      "pre_state": "v0.3.20 SQLite state store present at the legacy runtime data path; no 0.4 backup directory exists",
      "post_state": "byte-identical backup of the legacy store written and fsync'd under the 0.4 runtime data dir before any schema write",
      "failure_injection": "crash after the backup file is created but before its fsync/rename completes",
      "expected_failure_state": "legacy store untouched; partial backup is discarded on next start and re-created",
      "rollback_assertion": "restored backup hash equals the recorded pre-migration store hash and v0.3.20 opens it",
      "receipt_field": "receipts.filesystem.state_store_backup"
    },
    {
      "id": "mig.schema.topology_schema_created",
      "domain": "schema",
      "component": "vz-stack state store legacy -> topology migration",
      "source_reference": "crates/vz-stack/src/state_store/topology.rs LegacyMigrationStage::TopologySchemaCreated",
      "pre_state": "legacy sandbox tables only; no topology tables; user_version below the topology schema",
      "post_state": "topology tables created in one transaction with no project rows yet",
      "failure_injection": "abort after the topology schema DDL commits and before the first project write",
      "expected_failure_state": "topology tables exist and are empty; legacy tables unchanged; migration resumes idempotently",
      "rollback_assertion": "restoring the backup removes the topology tables and v0.3.20 reads the legacy tables",
      "state_schema_step": {
        "from": 1,
        "to": 2
      },
      "receipt_field": "receipts.schema.topology_schema_created"
    },
    {
      "id": "mig.schema.project_written",
      "domain": "schema",
      "component": "vz-stack state store legacy -> topology migration",
      "source_reference": "crates/vz-stack/src/state_store/topology.rs LegacyMigrationStage::ProjectWritten, LegacyMigrationFailpoint::AfterFirstProjectWrite",
      "pre_state": "topology schema exists; zero migrated Project/Environment/Machine rows",
      "post_state": "one Project, Environment, Machine and WorkspaceBinding row per migrated legacy Developer sandbox with legacy_sandbox_id UNIQUE and LegacyMigrationProvenance{source_version=v0.3.20}",
      "failure_injection": "abort after the first project write with further legacy sandboxes pending",
      "expected_failure_state": "the written project is complete and consistent; remaining sandboxes still classified as pending; re-run migrates only the remainder",
      "rollback_assertion": "restoring the backup leaves no project rows and every legacy sandbox record intact",
      "state_schema_step": {
        "from": 1,
        "to": 2
      },
      "receipt_field": "receipts.schema.project_written"
    },
    {
      "id": "mig.ownership.legacy_sandbox_classification",
      "domain": "ownership",
      "component": "vz-runtime-contract legacy Developer sandbox classification",
      "source_reference": "crates/vz-runtime-contract/src/types/topology.rs migrate_legacy_developer_sandbox, LegacyMigrationError",
      "pre_state": "legacy Sandbox records carry Developer marker, Hardened space-mode label, or neither",
      "post_state": "Developer records become Developer-profile Machines; Hardened/generic records keep their profile from provenance; ambiguous or non-arm64 records are rejected with LegacyMigrationError and left untouched",
      "failure_injection": "inject a record carrying both Developer and Hardened markers, and a LinuxFirecracker/Other backend record",
      "expected_failure_state": "migration reports AmbiguousClassification/UnresolvedTargetArchitecture for those records, writes nothing for them, and migrates the others",
      "rollback_assertion": "no Hardened or generic record is ever converted into Developer; rejected records are byte-identical after rollback",
      "state_schema_step": {
        "from": 1,
        "to": 2
      },
      "receipt_field": "receipts.ownership.legacy_sandbox_classification"
    },
    {
      "id": "mig.ownership.topology_v3_ownership_rebuilt",
      "domain": "ownership",
      "component": "vz-stack state store topology v3 migration",
      "source_reference": "crates/vz-stack/src/state_store/topology.rs TopologyV3MigrationStage::OwnershipRebuilt, TopologyV3MigrationFailpoint::AfterOwnershipRebuild",
      "pre_state": "topology rows lack v3 ownership columns/indexes",
      "post_state": "ownership rows rebuilt so every Machine, disk and Docker context has exactly one owning Environment",
      "failure_injection": "abort after ownership rebuild and before the lifecycle schema is created",
      "expected_failure_state": "ownership rows complete; lifecycle schema absent; user_version unchanged; migration resumes",
      "rollback_assertion": "backup restore drops ownership rows; no resource has two owners at any observable point",
      "state_schema_step": {
        "from": 2,
        "to": 3
      },
      "receipt_field": "receipts.ownership.topology_v3_ownership_rebuilt"
    },
    {
      "id": "mig.schema.topology_v3_lifecycle_schema",
      "domain": "schema",
      "component": "vz-stack state store topology v3 migration",
      "source_reference": "crates/vz-stack/src/state_store/topology.rs TopologyV3MigrationStage::LifecycleSchemaCreated",
      "pre_state": "ownership rebuilt; no lifecycle operation tables",
      "post_state": "lifecycle operation tables created; user_version advanced to 3",
      "failure_injection": "abort inside the lifecycle DDL transaction",
      "expected_failure_state": "transaction rolled back; ownership rows remain; user_version still 2",
      "rollback_assertion": "backup restore returns user_version to the legacy value",
      "state_schema_step": {
        "from": 2,
        "to": 3
      },
      "receipt_field": "receipts.schema.topology_v3_lifecycle_schema"
    },
    {
      "id": "mig.schema.stack_journal_v4",
      "domain": "schema",
      "component": "vz-stack state store stack journal v4 migration",
      "source_reference": "crates/vz-stack/src/state_store/topology.rs StackJournalV4MigrationStage::JournalSchemaCreated",
      "pre_state": "user_version 3; no stack journal tables",
      "post_state": "stack journal tables created; user_version 4",
      "failure_injection": "abort after journal DDL and before user_version update",
      "expected_failure_state": "journal tables present and empty or absent; user_version 3; migration is idempotent",
      "rollback_assertion": "backup restore has no journal tables",
      "state_schema_step": {
        "from": 3,
        "to": 4
      },
      "receipt_field": "receipts.schema.stack_journal_v4"
    },
    {
      "id": "mig.schema.replica_v5_durable_actions",
      "domain": "schema",
      "component": "vz-stack state store replica v5 migration",
      "source_reference": "crates/vz-stack/src/state_store/topology.rs ReplicaV5MigrationStage::DurableActionsRebuilt, ReplicaV5MigrationFailpoint::AfterDurableActionsRebuilt",
      "pre_state": "user_version 4; durable action rows in the pre-replica shape",
      "post_state": "durable action rows rebuilt with replica identity",
      "failure_injection": "abort after durable actions are rebuilt and before observed state is rebuilt",
      "expected_failure_state": "durable actions in v5 shape, observed state still v4, user_version 4; resume completes",
      "rollback_assertion": "backup restore returns durable actions to the v4 shape",
      "state_schema_step": {
        "from": 4,
        "to": 5
      },
      "receipt_field": "receipts.schema.replica_v5_durable_actions"
    },
    {
      "id": "mig.schema.replica_v5_observed_state",
      "domain": "schema",
      "component": "vz-stack state store replica v5 migration",
      "source_reference": "crates/vz-stack/src/state_store/topology.rs ReplicaV5MigrationStage::ObservedStateRebuilt, ReplicaV5MigrationFailpoint::AfterObservedStateRebuilt",
      "pre_state": "durable actions rebuilt; observed state in the v4 shape",
      "post_state": "observed state rebuilt per replica; user_version 5",
      "failure_injection": "abort after observed state rebuild and before user_version update",
      "expected_failure_state": "both tables in v5 shape; user_version 4; re-run detects the completed shape and only bumps the version",
      "rollback_assertion": "backup restore has v4 observed state",
      "state_schema_step": {
        "from": 4,
        "to": 5
      },
      "receipt_field": "receipts.schema.replica_v5_observed_state"
    },
    {
      "id": "mig.schema.reconcile_v6_terminal_history",
      "domain": "schema",
      "component": "vz-stack state store reconcile v6 migration",
      "source_reference": "crates/vz-stack/src/state_store/topology.rs ReconcileV6MigrationStage::TerminalHistoryArchived, ReconcileV6MigrationFailpoint::AfterTerminalHistoryArchived",
      "pre_state": "user_version 5; terminal reconcile history inline",
      "post_state": "terminal history archived to its own table",
      "failure_injection": "abort after archival and before durable actions are rebuilt",
      "expected_failure_state": "archive table populated; source rows retained; no double archival on resume",
      "rollback_assertion": "backup restore has no archive table and complete inline history",